{
  "request_id": "req_20261020_000123",
  "org_id": "org_001",
  "user_id": "user_001",
  "session_id": "sess_01JAB3K9Q2",
  "response_text": "[PATIENT_NAME_1] (P0012) has stage 3 CKD. Give morphine 10 mg every 4 hours.",
  "placeholder_manifest": [
    "[PATIENT_NAME_1]",
    "[NIC_1]"
  ],
  "categories": [
    "prescribing",
    "data_handling"
  ]
}